{
  "benchmark_id": "mth-0195-independent-cross-system-exploration",
  "candidate_contract": {
    "canonical": false,
    "claim_status": "proposed",
    "promotion_requires_human_review": true,
    "proven": false
  },
  "conditions": [
    {
      "definition": "Normalized unique token overlap with deterministic ordering, positive scores only, and bounded top-k=10.",
      "id": "bounded-lexical",
      "input_partition": "evaluation",
      "kind": "discovery",
      "output_bound": 10,
      "provenance": {
        "exact_model_id": null,
        "input_bundle_digest": "sha256:2de1ab317fab09628e7412335a0b8e612575a9884e5747580bf075dd3c01c0d3",
        "prompt_digest": null,
        "provider": null
      },
      "secret_safe_output": true,
      "status": "protocol-defined"
    },
    {
      "definition": "Future candidates preserve task-specific evidence IDs, typed claims, scope, task kind, and proven=false.",
      "id": "structured-evidence-bounded",
      "input_partition": "evaluation",
      "kind": "synthesis",
      "output_bound": 10,
      "provenance": {
        "exact_model_id": "none",
        "input_bundle_digest": "sha256:2de1ab317fab09628e7412335a0b8e612575a9884e5747580bf075dd3c01c0d3",
        "prompt_digest": null,
        "provider": "deterministic-fixture"
      },
      "secret_safe_output": true,
      "status": "protocol-defined"
    },
    {
      "definition": "Direct-LLM evaluation requires exact provider, model, prompt, input, runtime, and secret-safe output provenance.",
      "id": "direct-llm",
      "input_partition": "evaluation",
      "kind": "direct-llm",
      "not_evaluated_reason": "No model, prompt, runtime provenance, or model output was supplied.",
      "output_bound": 10,
      "provenance": {
        "exact_model_id": null,
        "input_bundle_digest": null,
        "prompt_digest": null,
        "provider": null,
        "runtime_digest": null
      },
      "secret_safe_output": false,
      "status": "not-evaluated"
    }
  ],
  "domain_slices": [
    {
      "digest": "sha256:cdaaf6902735d68be9d4f1c84b98285f16743c76c7c8ae4021a5465929046201",
      "domain": "isolation",
      "system_ids": [
        "carryctx",
        "firecracker",
        "git"
      ],
      "task_ids": [
        "task-19-boundary-firecracker",
        "task-20-boundary-carryctx-worktree",
        "task-21-boundary-collaboration-composition",
        "task-22-boundary-formal-security",
        "task-23-boundary-cross-layer-isolation",
        "task-24-boundary-reference-counterexample"
      ]
    },
    {
      "digest": "sha256:80c7f981ff02b23792827c6267224b103c121430687d8d28e085e55635b74f18",
      "domain": "orchestration",
      "system_ids": [
        "airflow",
        "crossplane",
        "kubernetes"
      ],
      "task_ids": [
        "task-13-orchestration-kubernetes-reconcile",
        "task-14-orchestration-airflow-dag",
        "task-15-orchestration-provider-composition",
        "task-16-orchestration-convergence-proof",
        "task-17-orchestration-exactly-once",
        "task-18-orchestration-reconcile-counterexample"
      ]
    },
    {
      "digest": "sha256:d87262cb5b9b4151073174c141645271861444e87d883c4d9299b117e6a6183a",
      "domain": "storage",
      "system_ids": [
        "duckdb",
        "postgresql",
        "sqlite"
      ],
      "task_ids": [
        "task-01-storage-local-transaction",
        "task-02-storage-replay-analytics",
        "task-03-storage-embedded-composition",
        "task-04-storage-universal-isolation",
        "task-05-storage-cross-file-snapshot",
        "task-06-storage-wal-order-counterexample"
      ]
    },
    {
      "digest": "sha256:3718c52575a35f0fc05448781af0fd34ca3c3aa83f1d0af885ba6c0121aa8848",
      "domain": "streaming",
      "system_ids": [
        "kafka",
        "temporal"
      ],
      "task_ids": [
        "task-07-stream-kafka-replay",
        "task-08-stream-temporal-history",
        "task-09-stream-workflow-composition",
        "task-10-stream-global-order",
        "task-11-stream-cross-history",
        "task-12-stream-partition-counterexample"
      ]
    }
  ],
  "evidence_bundle": {
    "digest": "sha256:2de1ab317fab09628e7412335a0b8e612575a9884e5747580bf075dd3c01c0d3",
    "id": "mth-0195-frozen-reviewed-evidence",
    "records": [
      {
        "card_evidence_id": "airflow-architecture-doc",
        "card_id": "airflow",
        "claim_type": "fact",
        "description": "Apache Airflow Architecture Overview; frozen reviewed-card reference only.",
        "id": "airflow:airflow-architecture-doc",
        "kind": "official-doc",
        "source_revision_id": "reviewed-cards"
      },
      {
        "card_evidence_id": "airflow-source-commit",
        "card_id": "airflow",
        "claim_type": "fact",
        "description": "Apache Airflow source at c01a68cb1e30; frozen reviewed-card reference only.",
        "id": "airflow:airflow-source-commit",
        "kind": "source-code",
        "source_revision_id": "reviewed-cards"
      },
      {
        "card_evidence_id": "airflow-executor-doc",
        "card_id": "airflow",
        "claim_type": "fact",
        "description": "Apache Airflow Executor; frozen reviewed-card reference only.",
        "id": "airflow:airflow-executor-doc",
        "kind": "official-doc",
        "source_revision_id": "reviewed-cards"
      },
      {
        "card_evidence_id": "carryctx-readme-fixed",
        "card_id": "carryctx",
        "claim_type": "fact",
        "description": "CarryCtx README at fixed CLI commit; frozen reviewed-card reference only.",
        "id": "carryctx:carryctx-readme-fixed",
        "kind": "official-doc",
        "source_revision_id": "reviewed-cards"
      },
      {
        "card_evidence_id": "carryctx-vcs-backend-source",
        "card_id": "carryctx",
        "claim_type": "fact",
        "description": "CarryCtx VCS backend boundary at fixed commit; frozen reviewed-card reference only.",
        "id": "carryctx:carryctx-vcs-backend-source",
        "kind": "source-code",
        "source_revision_id": "reviewed-cards"
      },
      {
        "card_evidence_id": "carryctx-worktrees-doc",
        "card_id": "carryctx",
        "claim_type": "fact",
        "description": "CarryCtx worktree documentation; frozen reviewed-card reference only.",
        "id": "carryctx:carryctx-worktrees-doc",
        "kind": "official-doc",
        "source_revision_id": "reviewed-cards"
      },
      {
        "card_evidence_id": "carryctx-merge-design-doc",
        "card_id": "carryctx",
        "claim_type": "fact",
        "description": "CarryCtx mergeable Git-managed state design; frozen reviewed-card reference only.",
        "id": "carryctx:carryctx-merge-design-doc",
        "kind": "official-doc",
        "source_revision_id": "reviewed-cards"
      },
      {
        "card_evidence_id": "crossplane-composition-doc",
        "card_id": "crossplane",
        "claim_type": "fact",
        "description": "Crossplane compositions; frozen reviewed-card reference only.",
        "id": "crossplane:crossplane-composition-doc",
        "kind": "official-doc",
        "source_revision_id": "reviewed-cards"
      },
      {
        "card_evidence_id": "crossplane-composition-source",
        "card_id": "crossplane",
        "claim_type": "fact",
        "description": "Crossplane composition functions controller at pinned commit; frozen reviewed-card reference only.",
        "id": "crossplane:crossplane-composition-source",
        "kind": "source-code",
        "source_revision_id": "reviewed-cards"
      },
      {
        "card_evidence_id": "crossplane-managed-doc",
        "card_id": "crossplane",
        "claim_type": "fact",
        "description": "Crossplane managed resources; frozen reviewed-card reference only.",
        "id": "crossplane:crossplane-managed-doc",
        "kind": "official-doc",
        "source_revision_id": "reviewed-cards"
      },
      {
        "card_evidence_id": "crossplane-managed-source",
        "card_id": "crossplane",
        "claim_type": "fact",
        "description": "Crossplane managed-resource reconciler at pinned commit; frozen reviewed-card reference only.",
        "id": "crossplane:crossplane-managed-source",
        "kind": "source-code",
        "source_revision_id": "reviewed-cards"
      },
      {
        "card_evidence_id": "duckdb-why",
        "card_id": "duckdb",
        "claim_type": "fact",
        "description": "Why DuckDB; frozen reviewed-card reference only.",
        "id": "duckdb:duckdb-why",
        "kind": "official-doc",
        "source_revision_id": "reviewed-cards"
      },
      {
        "card_evidence_id": "firecracker-design",
        "card_id": "firecracker",
        "claim_type": "fact",
        "description": "Firecracker Design; frozen reviewed-card reference only.",
        "id": "firecracker:firecracker-design",
        "kind": "official-doc",
        "source_revision_id": "reviewed-cards"
      },
      {
        "card_evidence_id": "git-data-model",
        "card_id": "git",
        "claim_type": "fact",
        "description": "Git user manual: Git objects and references; frozen reviewed-card reference only.",
        "id": "git:git-data-model",
        "kind": "official-doc",
        "source_revision_id": "reviewed-cards"
      },
      {
        "card_evidence_id": "kafka-introduction",
        "card_id": "kafka",
        "claim_type": "fact",
        "description": "Introduction to Apache Kafka; frozen reviewed-card reference only.",
        "id": "kafka:kafka-introduction",
        "kind": "official-doc",
        "source_revision_id": "reviewed-cards"
      },
      {
        "card_evidence_id": "kafka-repository-commit",
        "card_id": "kafka",
        "claim_type": "fact",
        "description": "Apache Kafka source at 787c2b4d9f03; frozen reviewed-card reference only.",
        "id": "kafka:kafka-repository-commit",
        "kind": "source-code",